_id,sensorId,type,vendorName,vendorEmail,description,location
65044d9e4b4addb8946bd1e6,16863,acoustic,Miller-Russell,robersonnancy@example.com,None future appear career night reduce clearly.,Ayalafurt
65044d9e4b4addb8946bd1e7,19158,humidity,Stewart Group,whiteheadchristopher@example.org,So again treat of.,Taylorton
65044d9e4b4addb8946bd1e8,49989,humidity,Boyd-Webb,alexander86@example.net,Point project three main protect hear all.,Lake Lori
65044d9e4b4addb8946bd1e9,73819,acoustic,"Green, Rogers and Spencer",sharppaul@example.com,Country because pick.,West Whitneyfurt
65044d9e4b4addb8946bd1ea,79729,humidity,"Cummings, Stout and Fowler",omaynard@example.net,Name wonder child movie her.,Williamsberg
65044d9e4b4addb8946bd1eb,69813,acoustic,Smith LLC,stephanie60@example.org,Artist great become item across movie available reason.,Johnsonmouth
65044d9e4b4addb8946bd1ec,44411,acoustic,Johnson-Hoffman,obailey@example.net,This industry response quickly.,Elizabethland
65044d9e4b4addb8946bd1ed,92250,humidity,Chang Group,dustin46@example.com,Movement front build coach.,Reynoldsberg
65044d9e4b4addb8946bd1ee,69603,temperature,"Smith, Cole and Rodgers",ytorres@example.org,Miss the method case.,New Jessicabury
65044d9e4b4addb8946bd1ef,84735,acoustic,Davis-Spears,jamesmorris@example.com,Voice ball culture.,Port Wanda
65044d9e4b4addb8946bd1f0,12249,temperature,Adams and Sons,greenechristopher@example.net,Card three very career top manage huge.,West Jennifershire
65044d9e4b4addb8946bd1f1,73716,temperature,Foster-Walker,chelseasmith@example.net,Wife gas once reality guess leave whatever talk.,Michaelmouth
65044d9e4b4addb8946bd1f2,54962,humidity,Hoover and Sons,drowland@example.com,Matter stop company next happy TV.,West Wesleymouth
65044d9e4b4addb8946bd1f3,17197,acoustic,Williams-Price,owenskathy@example.net,Drug knowledge subject none general we.,Masonview
65044d9e4b4addb8946bd1f4,54194,humidity,White Inc,ukeller@example.org,Movement like my for have walk our.,South Williamport
65044d9e4b4addb8946bd1f5,86035,humidity,Flores Group,haileybrown@example.com,Collection indeed interesting parent market.,East Brandon
65044d9e4b4addb8946bd1f6,78782,humidity,Gallagher PLC,kevinglenn@example.com,Executive begin kind nation evidence.,New Shelley
65044d9e4b4addb8946bd1f7,18883,humidity,"Ayers, Russell and Moody",brownryan@example.net,Military child care upon with win.,East Charles
65044d9e4b4addb8946bd1f8,13389,acoustic,Gutierrez LLC,williamsshelly@example.net,Recognize until fight executive poor foot.,Lake Michaelberg
65044d9e4b4addb8946bd1f9,71065,acoustic,Perry PLC,mmyers@example.com,Worker market amount cause.,East Davidstad
65044d9e4b4addb8946bd1fa,82325,temperature,"Smith, Meyer and Roberts",peterwilliams@example.net,Or foot bar protect.,Whiteberg
65044d9e4b4addb8946bd1fb,72280,humidity,York Inc,kristinamiller@example.org,Chair leader view product.,North Edwardmouth
65044d9e4b4addb8946bd1fc,21834,temperature,Barnett LLC,nblanchard@example.org,Size game central push factor.,Reedbury
65044d9e4b4addb8946bd1fd,17979,temperature,Pierce Inc,keithmartinez@example.org,Thus political there myself trouble with new have.,Port Robert
65044d9e4b4addb8946bd1fe,14354,acoustic,"Roberts, Edwards and Skinner",william04@example.org,Rest particular know bit others seat.,South Cynthia
65044d9e4b4addb8946bd1ff,19254,temperature,Harris LLC,sstrickland@example.net,Work clear ago rock share too public.,West Jack
65044d9e4b4addb8946bd200,27875,acoustic,"Jacobs, Nelson and Orozco",wardrobin@example.com,Edge behavior employee society.,Lake Amandamouth
65044d9e4b4addb8946bd201,47604,acoustic,"Delacruz, Bird and Parker",adamroberson@example.net,Usually kid hold up.,Sherryburgh
65044d9e4b4addb8946bd202,27341,humidity,Smith-Clark,aguirredavid@example.org,Movie instead since hope.,Calvintown
65044d9e4b4addb8946bd203,25992,humidity,"Long, Carroll and Little",nancycollins@example.net,Year program final they customer deep.,South Cameronberg
65044d9e4b4addb8946bd204,32302,humidity,"Williams, Walker and Calderon",mlane@example.com,Responsibility technology represent voice avoid store democratic.,Williamsside
65044d9e4b4addb8946bd205,50823,acoustic,"Johnson, Leonard and Moore",spencebrent@example.com,Past free consumer price window price billion.,East Edwinberg
65044d9e4b4addb8946bd206,96681,temperature,"Turner, Dixon and Mccarthy",robert28@example.net,Before talk able oil remember mind others.,South Reneebury
65044d9e4b4addb8946bd207,92171,humidity,"Mendoza, Watson and Morton",vbrooks@example.com,Shake young present wife cup always appear.,South Leahchester
65044d9e4b4addb8946bd208,96939,acoustic,Strong Ltd,hallpatrick@example.org,Quickly between view value series they somebody.,Rogerschester
65044d9e4b4addb8946bd209,95012,humidity,Morgan-Castillo,curtismarquez@example.org,Represent century value cell southern cold rather.,Port Angela
65044d9e4b4addb8946bd20a,42640,temperature,"Cisneros, White and Bird",ruizjoshua@example.net,Point different interview support line five point.,Terrymouth
65044d9e4b4addb8946bd20b,68118,humidity,Smith-Johnson,michael38@example.net,Live shoulder open game do continue president.,Port Erica
65044d9e4b4addb8946bd20c,71459,acoustic,Fowler-Smith,josephmcconnell@example.net,Purpose generation some brother campaign.,New Toddchester
65044d9e4b4addb8946bd20d,62388,humidity,"Porter, Lindsey and White",markperry@example.com,How grow voice bill.,Christopherville
65044d9e4b4addb8946bd20e,58259,temperature,Lee Inc,pmeyers@example.com,We research increase behind federal medical.,Whitakermouth
65044d9e4b4addb8946bd20f,58205,temperature,Brown-Obrien,johnsonphilip@example.com,Stay sound firm.,Edwardfort
65044d9e4b4addb8946bd210,57277,temperature,Ferguson Inc,nroberson@example.com,Record newspaper support treat class.,Olsonmouth
65044d9e4b4addb8946bd211,72394,temperature,"Griffin, Aguirre and Nelson",christopher67@example.org,Such him nor most do arm receive so.,Byrdview
65044d9e4b4addb8946bd212,89612,temperature,Waters and Sons,rebeccabutler@example.net,On natural happy reason.,East Max
65044d9e4b4addb8946bd213,87058,humidity,Taylor LLC,dmoore@example.com,Discussion staff father open any test upon should.,Johnsonburgh
65044d9e4b4addb8946bd214,53652,humidity,"Wade, Martin and Williams",blakelewis@example.org,Itself behind news anything price pressure increase.,East Emily
65044d9e4b4addb8946bd215,32390,temperature,Hubbard-Perkins,nkrueger@example.com,Item rise civil notice court.,Juliemouth
65044d9e4b4addb8946bd216,76292,temperature,Mayo PLC,erikjackson@example.com,Behind physical red material.,Hallbury
65044d9e4b4addb8946bd217,91318,humidity,Gillespie-Carney,gibbsjohn@example.com,Door charge daughter couple produce.,South Williamfort
65044d9e4b4addb8946bd218,19306,temperature,Marshall PLC,grahamkyle@example.com,Center free kid.,Jeffersonville
65044d9e4b4addb8946bd219,74888,humidity,Ritter-Watson,hallmichael@example.net,Environment money billion popular get.,Westberg
65044d9e4b4addb8946bd21a,33381,temperature,White Ltd,jamie72@example.net,During south head claim year hand they.,Nicholschester
65044d9e4b4addb8946bd21b,95499,acoustic,Mann and Sons,mperez@example.org,While gas south particularly.,Lake Stevenmouth
65044d9e4b4addb8946bd21c,97560,temperature,Young LLC,lindawhite@example.org,Drop by popular situation.,Brownshire
65044d9e4b4addb8946bd21d,64969,temperature,Beltran-Benson,laura13@example.net,Yourself few begin hand who everyone.,Stephensfort
65044d9e4b4addb8946bd21e,91152,humidity,Brown and Sons,omack@example.org,Management travel perform perform size with capital.,East Andrew
65044d9e4b4addb8946bd21f,18641,humidity,Dixon PLC,fmedina@example.com,Food hot physical current performance.,North Elizabeth
65044d9e4b4addb8946bd220,77728,temperature,Sims LLC,michelle42@example.net,Fly easy baby head discussion half.,Dickersontown
65044d9e4b4addb8946bd221,58489,acoustic,"Chang, Cunningham and Wong",xmoses@example.net,Pretty commercial cultural shoulder teacher field.,Sanchezshire
65044d9e4b4addb8946bd222,92010,acoustic,Harris-Rivera,xsilva@example.net,Treat magazine meeting happen leader.,Lake Deanchester
65044d9e4b4addb8946bd223,16485,acoustic,"Ward, Frazier and Schneider",markclark@example.org,Their camera easy carry.,Grayborough
65044d9e4b4addb8946bd224,10718,temperature,Rodgers Ltd,stephaniebarnett@example.org,Television game data.,Sandersland
65044d9e4b4addb8946bd225,80459,temperature,Wong-James,maryhenderson@example.com,Group right on also serve.,Kimberlyville
65044d9e4b4addb8946bd226,12417,acoustic,Smith-Michael,moralesfrank@example.org,From couple eight couple.,South Andrew
65044d9e4b4addb8946bd227,19176,temperature,"Robinson, Rivera and Taylor",jilljimenez@example.com,Worry performance boy board as score suggest produce.,East Roseshire
65044d9e4b4addb8946bd228,79912,acoustic,Nicholson and Sons,jeffreymartin@example.com,Fill drug above either true wife break method.,Alexisland
65044d9e4b4addb8946bd229,46652,temperature,Barton Ltd,vsanchez@example.com,Decide join although site area blue too hospital.,New Jessicaborough
65044d9e4b4addb8946bd22a,55478,humidity,"Conway, Anderson and Hale",cindyriley@example.net,Talk as voice land tend.,Melissaland
65044d9e4b4addb8946bd22b,44319,acoustic,Wade-Owen,imorgan@example.com,Situation writer tree type.,Amandaside
65044d9e4b4addb8946bd22c,52628,temperature,Chen-Kane,gary37@example.com,Behavior themselves easy house.,Collinsside
65044d9e4b4addb8946bd22d,79930,humidity,"Fry, Caldwell and Pierce",swansondaniel@example.net,Catch though catch provide.,Sharpville
65044d9e4b4addb8946bd22e,45935,acoustic,Pham Inc,salazarmary@example.com,Carry until join bad trip them.,New Phillipchester
65044d9e4b4addb8946bd22f,92702,acoustic,Green and Sons,steven83@example.com,Decide the collection ten.,Davidburgh
65044d9e4b4addb8946bd230,47129,temperature,Powell and Sons,ctapia@example.org,Face pay teach.,South Ryan
65044d9e4b4addb8946bd231,48821,humidity,Evans-Best,barberjoel@example.com,A always fall wide themselves.,Orozcoshire
65044d9e4b4addb8946bd232,18420,acoustic,Hubbard and Sons,hessdylan@example.org,While network natural move.,North Natashabury
65044d9e4b4addb8946bd233,70932,acoustic,Barnett-Arroyo,hunter67@example.org,Suddenly within painting.,Lake Patrick
65044d9e4b4addb8946bd234,92758,temperature,Paul-Johnston,glennberger@example.org,Affect summer finish market woman Mr rest.,Port Daniel
65044d9e4b4addb8946bd235,39586,humidity,"Ruiz, Nguyen and Jones",nathanbowen@example.org,Matter white impact share sense.,Gibsonborough
65044d9e4b4addb8946bd236,60006,acoustic,Bradley PLC,preed@example.org,Analysis moment stop take simply.,East Jonathan
65044d9e4b4addb8946bd237,47507,temperature,"Burgess, Lopez and Garcia",anita61@example.org,Project imagine star practice table nothing.,Travisfort
65044d9e4b4addb8946bd238,60841,acoustic,Brandt and Sons,starkemily@example.com,Top approach system accept image.,New Denise
65044d9e4b4addb8946bd239,23224,temperature,Collins LLC,ashley48@example.org,Local talk always expert home president music.,Jessicaview
65044d9e4b4addb8946bd23a,19470,acoustic,"Robinson, Patel and Lester",istone@example.com,This national evening Congress couple.,New Stephen
65044d9e4b4addb8946bd23b,63768,temperature,Smith LLC,dwilliamson@example.com,Mind all lose thus hand.,Nathanside
65044d9e4b4addb8946bd23c,57724,humidity,"Maddox, Williams and Bowman",rebeccanguyen@example.org,Reduce tree safe economic experience music teacher.,Port Ruth
65044d9e4b4addb8946bd23d,74632,acoustic,"Bailey, Moss and Hale",dburns@example.net,Popular today never mother fact true management ever.,North Gregoryfort
65044d9e4b4addb8946bd23e,56831,acoustic,Woodward Ltd,janet35@example.org,Book understand president area key record.,North Vickie
65044d9e4b4addb8946bd23f,78553,temperature,White Ltd,holderamy@example.org,Early already rock top.,Lambstad
65044d9e4b4addb8946bd240,34131,humidity,Williams-Patterson,michelemartinez@example.com,Test side yeah attack necessary pass go question.,Weisschester
65044d9e4b4addb8946bd241,69529,acoustic,Williams Inc,andrewprice@example.org,Military television bank fast approach.,Chanmouth
65044d9e4b4addb8946bd242,73448,temperature,Lucero-Anderson,pmanning@example.org,True go dark force card bill article significant.,Manningmouth
65044d9e4b4addb8946bd243,78030,temperature,Medina-Stewart,eochoa@example.net,Together contain image return rule mission.,Kathystad
65044d9e4b4addb8946bd244,76755,temperature,Wu-Lane,donna14@example.com,Dark away deep need offer.,Ramseyfort
65044d9e4b4addb8946bd245,34180,temperature,House-Brown,fwilliams@example.com,Carry contain evidence until probably bit time.,West Taramouth
65044d9e4b4addb8946bd246,77587,acoustic,Lynch Group,nparker@example.net,Factor employee seven heart.,North Davidmouth
65044d9e4b4addb8946bd247,16934,temperature,Anderson Ltd,odonnellluke@example.org,Approach under natural community professor.,Jenniferstad
65044d9e4b4addb8946bd248,85781,humidity,Fisher-Owens,smithrodney@example.org,Protect education city garden car.,East Christina
65044d9e4b4addb8946bd249,50535,humidity,Jarvis Group,jrice@example.net,Might ground tell seem rest drop scientist while.,East Laurenmouth
